{"type":"config","name":"mind2web-agent-efficiency","metricName":"llm_calls","metricUnit":"count","bestDirection":"lower"}
{"run":1,"commit":"4c09ee6","metric":15,"metrics":{"output_tokens":551,"actions":15,"snapshots":5,"total_input_tokens":140809,"peak_input_tokens":14542,"duration_ms":62035,"tool_errors":1,"passed":1},"status":"keep","description":"baseline with capped ARIA snapshots","timestamp":1783639883,"segment":0}
{"run":2,"commit":"cf6f410","metric":0,"metrics":{"output_tokens":8697,"actions":257,"snapshots":85,"total_input_tokens":4438367,"peak_input_tokens":44092,"duration_ms":601624,"tool_errors":1,"passed":0},"status":"crash","description":"clarify critical-point required fields; provider entered repeated search cycle","timestamp":1783640549,"segment":0}
{"run":3,"commit":"38a1c3f","metric":15,"metrics":{"output_tokens":1282,"actions":20,"snapshots":6,"total_input_tokens":176600,"peak_input_tokens":18286,"duration_ms":60043,"tool_errors":1,"passed":0},"status":"discard","description":"cycle detector candidate; model left a critical point pending","timestamp":1783640844,"segment":0}
{"run":4,"commit":"48a9b83","metric":21,"metrics":{"output_tokens":1323,"actions":14,"snapshots":10,"total_input_tokens":258658,"peak_input_tokens":19474,"duration_ms":143056,"tool_errors":0,"passed":0},"status":"discard","description":"separate empty-turn budget; cycle detector stopped repeated snapshots","timestamp":1783641100,"segment":0}
{"run":5,"commit":"48a9b83","metric":18,"metrics":{"output_tokens":858,"actions":25,"snapshots":8,"total_input_tokens":201000,"peak_input_tokens":16182,"duration_ms":45286,"tool_errors":0,"passed":0},"status":"discard","description":"repeat empty-turn budget; cycle detector stopped repeated search loop","timestamp":1783641151,"segment":0}
{"run":6,"commit":"4115b05","metric":18,"metrics":{"output_tokens":752,"actions":14,"snapshots":6,"total_input_tokens":198279,"peak_input_tokens":15234,"duration_ms":41588,"tool_errors":0,"passed":1},"status":"discard","description":"batch-final compact observation run 1","timestamp":1783641350,"segment":0}
{"run":7,"commit":"4115b05","metric":13,"metrics":{"output_tokens":689,"actions":15,"snapshots":5,"total_input_tokens":131326,"peak_input_tokens":14713,"duration_ms":46767,"tool_errors":0,"passed":1},"status":"discard","description":"batch-final compact observation run 2","timestamp":1783641420,"segment":0}
{"run":8,"commit":"4115b05","metric":12,"metrics":{"output_tokens":473,"actions":13,"snapshots":4,"total_input_tokens":116573,"peak_input_tokens":14546,"duration_ms":81709,"tool_errors":1,"passed":1},"status":"discard","description":"batch-final compact observation run 3","timestamp":1783641486,"segment":0}
{"type":"config","name":"mind2web-apartments-efficiency","metricName":"llm_calls","metricUnit":"count","bestDirection":"lower"}
{"run":9,"commit":"3b19490","metric":0,"metrics":{"output_tokens":118,"actions":3,"snapshots":1,"total_input_tokens":20298,"peak_input_tokens":7087,"duration_ms":36141,"tool_errors":0,"passed":0},"status":"crash","description":"Apartments baseline blocked by deterministic Akamai 403","timestamp":1783641680,"segment":1}
{"type":"config","name":"mind2web-accuweather-efficiency","metricName":"llm_calls","metricUnit":"count","bestDirection":"lower"}
{"run":10,"commit":"8fd6258","metric":0,"metrics":{"output_tokens":128,"actions":2,"snapshots":0,"total_input_tokens":26775,"peak_input_tokens":6791,"duration_ms":8263,"tool_errors":2,"passed":0},"status":"crash","description":"AccuWeather baseline blocked by HTTP/2 protocol errors","timestamp":1783641750,"segment":2}
{"type":"config","name":"mind2web-weather-10day-efficiency","metricName":"llm_calls","metricUnit":"count","bestDirection":"lower"}
{"run":11,"commit":"05e435b","metric":15,"metrics":{"output_tokens":718,"actions":11,"snapshots":3,"total_input_tokens":137121,"peak_input_tokens":16988,"duration_ms":48964,"tool_errors":1,"passed":1},"status":"keep","description":"Weather.com 10-day forecast baseline","timestamp":1783641879,"segment":3}
{"run":12,"commit":"05e435b","metric":25,"metrics":{"output_tokens":1164,"actions":12,"snapshots":4,"total_input_tokens":252165,"peak_input_tokens":14661,"duration_ms":61474,"tool_errors":8,"passed":1},"status":"discard","description":"fixed snapshot schema plus exact-target prompt; model repeated ambiguous click","timestamp":1783642020,"segment":3}
{"run":13,"commit":"05e435b","metric":25,"metrics":{"output_tokens":1129,"actions":16,"snapshots":6,"total_input_tokens":270461,"peak_input_tokens":14619,"duration_ms":82929,"tool_errors":3,"passed":1},"status":"discard","description":"fixed snapshot schema plus failed-action recording run 1","timestamp":1783642150,"segment":3}
{"run":14,"commit":"05e435b","metric":12,"metrics":{"output_tokens":453,"actions":12,"snapshots":4,"total_input_tokens":115078,"peak_input_tokens":14587,"duration_ms":28052,"tool_errors":1,"passed":1},"status":"discard","description":"fixed snapshot schema plus failed-action recording run 2","timestamp":1783642220,"segment":3}
{"run":15,"commit":"05e435b","metric":24,"metrics":{"output_tokens":1740,"actions":21,"snapshots":7,"total_input_tokens":247872,"peak_input_tokens":15338,"duration_ms":78543,"tool_errors":1,"passed":1},"status":"discard","description":"fixed snapshot schema plus failed-action recording run 3","timestamp":1783642308,"segment":3}
{"run":16,"commit":"05e435b","metric":21,"metrics":{"output_tokens":1392,"actions":21,"snapshots":7,"total_input_tokens":209355,"peak_input_tokens":15063,"duration_ms":58150,"tool_errors":3,"passed":1},"status":"discard","description":"strict-mode ambiguity recovery guidance run 1","timestamp":1783642500,"segment":3}
{"run":17,"commit":"05e435b","metric":27,"metrics":{"output_tokens":1579,"actions":27,"snapshots":14,"total_input_tokens":328712,"peak_input_tokens":19567,"duration_ms":187346,"tool_errors":0,"passed":0},"status":"discard","description":"strict-mode ambiguity recovery guidance run 2; cycle guard stopped loop","timestamp":1783642653,"segment":3}
{"type":"config","name":"mind2web-weather-health-efficiency","metricName":"llm_calls","metricUnit":"count","bestDirection":"lower"}
{"run":18,"commit":"2a929b9","metric":37,"metrics":{"output_tokens":2270,"actions":40,"snapshots":15,"total_input_tokens":443272,"peak_input_tokens":18451,"duration_ms":187732,"tool_errors":0,"passed":0},"status":"crash","description":"health forecast baseline; cycle detector stopped repeated search submission","timestamp":1783643053,"segment":4}
